[
  {
    "sourceId": "atlas-pr-048",
    "source": "github",
    "squadId": "atlas",
    "title": "Add rate limiting middleware to billing API",
    "url": "https://github.com/arcline-inc/platform/pull/48",
    "lastUpdated": "2026-05-19T10:14:00Z",
    "raw": {
      "number": 48,
      "state": "merged",
      "merged": true,
      "merged_at": "2026-05-19T10:14:00Z",
      "author": "sarah-chen",
      "body": "Adds per-tenant rate limiting (1000 req/min) to all /billing/* endpoints. Refs ATLS-38.",
      "linked_jira_key": "ATLS-38",
      "base_branch": "main",
      "head_branch": "feature/billing-rate-limit",
      "changed_files": 5,
      "additions": 98,
      "deletions": 12,
      "reviewers": [
        "alex-kumar",
        "morgan-park"
      ],
      "labels": [
        "backend",
        "billing",
        "security"
      ]
    }
  },
  {
    "sourceId": "atlas-pr-049",
    "source": "github",
    "squadId": "atlas",
    "title": "Migrate auth tokens to Lumen /api/auth/tokens/v2",
    "url": "https://github.com/arcline-inc/platform/pull/49",
    "lastUpdated": "2026-05-20T15:42:00Z",
    "raw": {
      "number": 49,
      "state": "merged",
      "merged": true,
      "merged_at": "2026-05-20T15:42:00Z",
      "author": "sarah-chen",
      "body": "Updates our auth token acquisition to use Lumen's new /api/auth/tokens/v2 endpoint, which shipped Monday. The v1 endpoint is being sunset on June 15. This unblocks ATLS-55 (premium tier gating). Depends on Lumen deploying their auth-tokens-v2 branch to prod \u2014 confirmed deployed as of 2026-05-18.",
      "linked_jira_key": "ATLS-55",
      "base_branch": "main",
      "head_branch": "chore/migrate-lumen-auth-v2",
      "changed_files": 3,
      "additions": 41,
      "deletions": 39,
      "reviewers": [
        "jordan-lee"
      ],
      "labels": [
        "chore",
        "auth",
        "cross-team"
      ]
    }
  },
  {
    "sourceId": "atlas-pr-050",
    "source": "github",
    "squadId": "atlas",
    "title": "Fix NPE in subscription payment processor",
    "url": "https://github.com/arcline-inc/platform/pull/50",
    "lastUpdated": "2026-05-20T09:07:00Z",
    "raw": {
      "number": 50,
      "state": "merged",
      "merged": true,
      "merged_at": "2026-05-20T09:07:00Z",
      "author": "alex-kumar",
      "body": "Null check for `payment.metadata.customerId` when processing Stripe webhook events. Caused 3 silent failures in staging last week.",
      "linked_jira_key": "ATLS-41",
      "base_branch": "main",
      "head_branch": "fix/payment-processor-npe",
      "changed_files": 2,
      "additions": 7,
      "deletions": 2,
      "reviewers": [
        "sarah-chen"
      ],
      "labels": [
        "bug",
        "billing",
        "hotfix"
      ]
    }
  },
  {
    "sourceId": "atlas-pr-051",
    "source": "github",
    "squadId": "atlas",
    "title": "Complete billing API refactor \u2014 ATLS-42",
    "url": "https://github.com/arcline-inc/platform/pull/51",
    "lastUpdated": "2026-05-22T17:55:00Z",
    "raw": {
      "number": 51,
      "state": "merged",
      "merged": true,
      "merged_at": "2026-05-22T17:55:00Z",
      "author": "jordan-lee",
      "body": "Closes ATLS-42. Refactors billing API to follow the new REST conventions from the architecture review. Splits monolithic BillingService into BillingQueryService and BillingCommandService. Fully deployed to staging; load tests passing at 5x expected peak.",
      "linked_jira_key": "ATLS-42",
      "base_branch": "main",
      "head_branch": "feature/billing-api-refactor",
      "changed_files": 22,
      "additions": 634,
      "deletions": 418,
      "reviewers": [
        "sarah-chen",
        "alex-kumar"
      ],
      "labels": [
        "backend",
        "billing",
        "refactor"
      ]
    }
  },
  {
    "sourceId": "atlas-pr-052",
    "source": "github",
    "squadId": "atlas",
    "title": "Remove deprecated /billing/v1 endpoints",
    "url": "https://github.com/arcline-inc/platform/pull/52",
    "lastUpdated": "2026-05-21T13:20:00Z",
    "raw": {
      "number": 52,
      "state": "merged",
      "merged": true,
      "merged_at": "2026-05-21T13:20:00Z",
      "author": "alex-kumar",
      "body": "Removes /billing/v1/* endpoints per the deprecation notice from Q1. All callers have migrated per Datadog trace analysis. Refs ATLS-29.",
      "linked_jira_key": "ATLS-29",
      "base_branch": "main",
      "head_branch": "chore/remove-billing-v1",
      "changed_files": 8,
      "additions": 0,
      "deletions": 287,
      "reviewers": [
        "jordan-lee"
      ],
      "labels": [
        "chore",
        "billing",
        "cleanup"
      ]
    }
  },
  {
    "sourceId": "atlas-pr-053",
    "source": "github",
    "squadId": "atlas",
    "title": "Add unit tests for subscription renewal logic",
    "url": "https://github.com/arcline-inc/platform/pull/53",
    "lastUpdated": "2026-05-23T11:05:00Z",
    "raw": {
      "number": 53,
      "state": "open",
      "merged": false,
      "merged_at": null,
      "author": "morgan-park",
      "body": "WIP: adding missing coverage for edge cases in subscription renewal. Currently at 62% \u2192 targeting 85%.",
      "linked_jira_key": "ATLS-44",
      "base_branch": "main",
      "head_branch": "test/subscription-renewal-coverage",
      "changed_files": 4,
      "additions": 312,
      "deletions": 5,
      "reviewers": [],
      "labels": [
        "test",
        "billing"
      ]
    }
  },
  {
    "sourceId": "atlas-pr-054",
    "source": "github",
    "squadId": "atlas",
    "title": "Fix webhook HMAC signature validation",
    "url": "https://github.com/arcline-inc/platform/pull/54",
    "lastUpdated": "2026-05-23T16:33:00Z",
    "raw": {
      "number": 54,
      "state": "open",
      "merged": false,
      "merged_at": null,
      "author": "sarah-chen",
      "body": "Stripe webhooks were rejecting valid events due to timing skew. Switching from Date.now() to a monotonic clock for HMAC timestamp window checks.",
      "linked_jira_key": "ATLS-47",
      "base_branch": "main",
      "head_branch": "fix/webhook-hmac-timing",
      "changed_files": 2,
      "additions": 18,
      "deletions": 11,
      "reviewers": [
        "alex-kumar"
      ],
      "labels": [
        "bug",
        "billing",
        "security"
      ]
    }
  },
  {
    "sourceId": "atlas-pr-055",
    "source": "github",
    "squadId": "atlas",
    "title": "Add billing analytics: MRR breakdown query",
    "url": "https://github.com/arcline-inc/platform/pull/55",
    "lastUpdated": "2026-05-21T09:00:00Z",
    "raw": {
      "number": 55,
      "state": "closed",
      "merged": false,
      "merged_at": null,
      "author": "alex-kumar",
      "body": "Closed without merging \u2014 scope moved to PRD-analytics track. See ATLS-50 for tracking.",
      "linked_jira_key": "ATLS-50",
      "base_branch": "main",
      "head_branch": "feature/mrr-breakdown",
      "changed_files": 6,
      "additions": 221,
      "deletions": 0,
      "reviewers": [],
      "labels": [
        "analytics",
        "billing"
      ]
    }
  },
  {
    "sourceId": "atlas-pr-056",
    "source": "github",
    "squadId": "atlas",
    "title": "Update billing docs: REST API reference",
    "url": "https://github.com/arcline-inc/platform/pull/56",
    "lastUpdated": "2026-05-21T08:30:00Z",
    "raw": {
      "number": 56,
      "state": "merged",
      "merged": true,
      "merged_at": "2026-05-21T08:30:00Z",
      "author": "morgan-park",
      "body": "Docs update following the v2 API refactor. Adds request/response examples for all billing endpoints.",
      "linked_jira_key": null,
      "base_branch": "main",
      "head_branch": "docs/billing-api-v2",
      "changed_files": 3,
      "additions": 187,
      "deletions": 94,
      "reviewers": [
        "jordan-lee"
      ],
      "labels": [
        "docs"
      ]
    }
  },
  {
    "sourceId": "atlas-pr-057",
    "source": "github",
    "squadId": "atlas",
    "title": "Add feature flags for premium tier entitlements",
    "url": "https://github.com/arcline-inc/platform/pull/57",
    "lastUpdated": "2026-05-24T14:10:00Z",
    "raw": {
      "number": 57,
      "state": "open",
      "merged": false,
      "merged_at": null,
      "author": "jordan-lee",
      "body": "Introduces LaunchDarkly feature flags for gating premium tier features. Blocked on ATLS-55 (new auth token migration) being deployed to prod.",
      "linked_jira_key": "ATLS-55",
      "base_branch": "main",
      "head_branch": "feature/premium-feature-flags",
      "changed_files": 9,
      "additions": 256,
      "deletions": 43,
      "reviewers": [
        "sarah-chen"
      ],
      "labels": [
        "feature",
        "premium",
        "feature-flags"
      ]
    }
  }
]