[
  {
    "sourceId": "forge-pr-019",
    "source": "github",
    "squadId": "forge",
    "title": "Implement iOS home screen widget (small variant)",
    "url": "https://github.com/arcline-inc/mobile/pull/19",
    "lastUpdated": "2026-05-05T14:00:00Z",
    "raw": {
      "number": 19,
      "state": "open",
      "merged": false,
      "merged_at": null,
      "author": "mei-tanaka",
      "body": "WidgetKit implementation started. Reading from shared App Group container — scaffolding in place. UI design in Figma but not yet reviewed with design lead. Refs FORGE-31.",
      "linked_jira_key": "FORGE-31",
      "base_branch": "main",
      "head_branch": "feature/ios-widget-small",
      "changed_files": 3,
      "additions": 72,
      "deletions": 0,
      "reviewers": [],
      "labels": ["feature", "ios", "widget"]
    }
  },
  {
    "sourceId": "forge-pr-020",
    "source": "github",
    "squadId": "forge",
    "title": "Add haptic feedback to card swipe gestures",
    "url": "https://github.com/arcline-inc/mobile/pull/20",
    "lastUpdated": "2026-05-06T11:10:00Z",
    "raw": {
      "number": 20,
      "state": "open",
      "merged": false,
      "merged_at": null,
      "author": "carlos-mendez",
      "body": "UIImpactFeedbackGenerator for card dismiss/archive swipe. Figma spec calls for light impact on start, medium on completion. Implementation done, needs review. Refs FORGE-33.",
      "linked_jira_key": "FORGE-33",
      "base_branch": "main",
      "head_branch": "feature/haptic-swipe",
      "changed_files": 3,
      "additions": 44,
      "deletions": 5,
      "reviewers": ["mei-tanaka"],
      "labels": ["feature", "ios", "ux"]
    }
  },
  {
    "sourceId": "forge-pr-021",
    "source": "github",
    "squadId": "forge",
    "title": "Fix memory leak in camera permission module",
    "url": "https://github.com/arcline-inc/mobile/pull/21",
    "lastUpdated": "2026-05-07T09:00:00Z",
    "raw": {
      "number": 21,
      "state": "open",
      "merged": false,
      "merged_at": null,
      "author": "mei-tanaka",
      "body": "Instruments shows 12MB/session leak in camera permission module. AVCaptureSession delegate not released on dealloc. Applying weak reference pattern. Fixes FORGE-29.",
      "linked_jira_key": "FORGE-29",
      "base_branch": "main",
      "head_branch": "fix/camera-memory-leak",
      "changed_files": 2,
      "additions": 8,
      "deletions": 4,
      "reviewers": [],
      "labels": ["bug", "ios", "memory"]
    }
  },
  {
    "sourceId": "forge-pr-022",
    "source": "github",
    "squadId": "forge",
    "title": "Implement tab bar navigation structure",
    "url": "https://github.com/arcline-inc/mobile/pull/22",
    "lastUpdated": "2026-05-05T11:00:00Z",
    "raw": {
      "number": 22,
      "state": "open",
      "merged": false,
      "merged_at": null,
      "author": "carlos-mendez",
      "body": "Sprint kickoff: implementing UITabBarController per navigation architecture agreed in sprint planning. Four tabs: Home, Tasks, Notifications, Profile. Refs FORGE-30.",
      "linked_jira_key": "FORGE-30",
      "base_branch": "main",
      "head_branch": "feature/tab-bar-navigation",
      "changed_files": 2,
      "additions": 48,
      "deletions": 0,
      "reviewers": [],
      "labels": ["feature", "ios", "navigation"]
    }
  },
  {
    "sourceId": "forge-pr-024",
    "source": "github",
    "squadId": "forge",
    "title": "Add offline mode: local SQLite task cache",
    "url": "https://github.com/arcline-inc/mobile/pull/24",
    "lastUpdated": "2026-05-08T10:00:00Z",
    "raw": {
      "number": 24,
      "state": "open",
      "merged": false,
      "merged_at": null,
      "author": "carlos-mendez",
      "body": "Scoping SQLite-backed task cache using GRDB. This is a complex feature — evaluating sync strategy before full implementation. Refs FORGE-32.",
      "linked_jira_key": "FORGE-32",
      "base_branch": "main",
      "head_branch": "feature/offline-mode",
      "changed_files": 2,
      "additions": 31,
      "deletions": 0,
      "reviewers": [],
      "labels": ["feature", "ios", "offline", "storage"]
    }
  },
  {
    "sourceId": "forge-pr-025",
    "source": "github",
    "squadId": "forge",
    "title": "Fix crash on iOS 16 during device rotation in task view",
    "url": "https://github.com/arcline-inc/mobile/pull/25",
    "lastUpdated": "2026-05-07T08:00:00Z",
    "raw": {
      "number": 25,
      "state": "open",
      "merged": false,
      "merged_at": null,
      "author": "mei-tanaka",
      "body": "iOS 16 regression from grid layout refactor — crash on rotation in task view. UICollectionViewLayout invalidation calling reloadData before layout commits. Investigating fix. Fixes FORGE-28.",
      "linked_jira_key": "FORGE-28",
      "base_branch": "main",
      "head_branch": "fix/ios16-rotation-crash",
      "changed_files": 1,
      "additions": 3,
      "deletions": 1,
      "reviewers": [],
      "labels": ["bug", "ios", "crash", "ios16"]
    }
  },
  {
    "sourceId": "forge-pr-026",
    "source": "github",
    "squadId": "forge",
    "title": "Add deep link routing for push notification tap targets",
    "url": "https://github.com/arcline-inc/mobile/pull/26",
    "lastUpdated": "2026-05-08T14:00:00Z",
    "raw": {
      "number": 26,
      "state": "open",
      "merged": false,
      "merged_at": null,
      "author": "carlos-mendez",
      "body": "arcline:// deep link scheme scaffolding. Blocked on forge-pr-022 (tab bar) completing — routing depends on final navigation structure. Refs FORGE-36.",
      "linked_jira_key": "FORGE-36",
      "base_branch": "main",
      "head_branch": "feature/deep-link-routing",
      "changed_files": 2,
      "additions": 28,
      "deletions": 0,
      "reviewers": [],
      "labels": ["feature", "ios", "navigation", "push-notifications"]
    }
  }
]
