[
  {
    "sourceId": "atlas-pr-048",
    "source": "github",
    "squadId": "atlas",
    "title": "Add rate limiting middleware to billing API",
    "url": "https://github.com/arcline-inc/platform/pull/48",
    "lastUpdated": "2026-05-12T09:00:00Z",
    "raw": {
      "number": 48,
      "state": "open",
      "merged": false,
      "merged_at": null,
      "author": "sarah-chen",
      "body": "Adds per-tenant rate limiting (1000 req/min) to all /billing/* endpoints. Implementation complete — in review. Refs ATLS-38.",
      "linked_jira_key": "ATLS-38",
      "base_branch": "main",
      "head_branch": "feature/billing-rate-limit",
      "changed_files": 5,
      "additions": 98,
      "deletions": 12,
      "reviewers": ["alex-kumar", "morgan-park"],
      "labels": ["backend", "billing", "security"]
    }
  },
  {
    "sourceId": "atlas-pr-049",
    "source": "github",
    "squadId": "atlas",
    "title": "Migrate auth tokens to Lumen /api/auth/tokens/v2",
    "url": "https://github.com/arcline-inc/platform/pull/49",
    "lastUpdated": "2026-05-12T10:00:00Z",
    "raw": {
      "number": 49,
      "state": "open",
      "merged": false,
      "merged_at": null,
      "author": "sarah-chen",
      "body": "Still blocked — Lumen auth v2 endpoint is in review but not yet deployed to prod. Pinged priya-nair for ETA. June 15 v1 sunset is 5 weeks away — timeline is tight if Lumen slips. Refs ATLS-55.",
      "linked_jira_key": "ATLS-55",
      "base_branch": "main",
      "head_branch": "chore/migrate-lumen-auth-v2",
      "changed_files": 3,
      "additions": 41,
      "deletions": 39,
      "reviewers": ["jordan-lee"],
      "labels": ["chore", "auth", "cross-team", "blocked"]
    }
  },
  {
    "sourceId": "atlas-pr-050",
    "source": "github",
    "squadId": "atlas",
    "title": "Fix NPE in subscription payment processor",
    "url": "https://github.com/arcline-inc/platform/pull/50",
    "lastUpdated": "2026-05-13T09:07:00Z",
    "raw": {
      "number": 50,
      "state": "merged",
      "merged": true,
      "merged_at": "2026-05-13T09:07:00Z",
      "author": "alex-kumar",
      "body": "Null check for `payment.metadata.customerId` when processing Stripe webhook events. Caused 3 silent failures in staging last week.",
      "linked_jira_key": "ATLS-41",
      "base_branch": "main",
      "head_branch": "fix/payment-processor-npe",
      "changed_files": 2,
      "additions": 7,
      "deletions": 2,
      "reviewers": ["sarah-chen"],
      "labels": ["bug", "billing", "hotfix"]
    }
  },
  {
    "sourceId": "atlas-pr-051",
    "source": "github",
    "squadId": "atlas",
    "title": "Complete billing API refactor — ATLS-42",
    "url": "https://github.com/arcline-inc/platform/pull/51",
    "lastUpdated": "2026-05-14T11:00:00Z",
    "raw": {
      "number": 51,
      "state": "open",
      "merged": false,
      "merged_at": null,
      "author": "jordan-lee",
      "body": "CQRS split complete — read/write paths separated. Deploying to staging for load tests this week. Closes ATLS-42.",
      "linked_jira_key": "ATLS-42",
      "base_branch": "main",
      "head_branch": "feature/billing-api-refactor",
      "changed_files": 18,
      "additions": 510,
      "deletions": 380,
      "reviewers": ["sarah-chen", "alex-kumar"],
      "labels": ["backend", "billing", "refactor"]
    }
  },
  {
    "sourceId": "atlas-pr-052",
    "source": "github",
    "squadId": "atlas",
    "title": "Remove deprecated /billing/v1 endpoints",
    "url": "https://github.com/arcline-inc/platform/pull/52",
    "lastUpdated": "2026-05-13T13:00:00Z",
    "raw": {
      "number": 52,
      "state": "open",
      "merged": false,
      "merged_at": null,
      "author": "alex-kumar",
      "body": "Ready to merge once ATLS-42 refactor lands — shared code paths resolved. Refs ATLS-29.",
      "linked_jira_key": "ATLS-29",
      "base_branch": "main",
      "head_branch": "chore/remove-billing-v1",
      "changed_files": 8,
      "additions": 0,
      "deletions": 287,
      "reviewers": ["jordan-lee"],
      "labels": ["chore", "billing", "cleanup"]
    }
  },
  {
    "sourceId": "atlas-pr-053",
    "source": "github",
    "squadId": "atlas",
    "title": "Add unit tests for subscription renewal logic",
    "url": "https://github.com/arcline-inc/platform/pull/53",
    "lastUpdated": "2026-05-15T11:05:00Z",
    "raw": {
      "number": 53,
      "state": "open",
      "merged": false,
      "merged_at": null,
      "author": "morgan-park",
      "body": "WIP: adding missing coverage for edge cases in subscription renewal. Currently at 42% — targeting 85%.",
      "linked_jira_key": "ATLS-44",
      "base_branch": "main",
      "head_branch": "test/subscription-renewal-coverage",
      "changed_files": 3,
      "additions": 187,
      "deletions": 3,
      "reviewers": [],
      "labels": ["test", "billing"]
    }
  },
  {
    "sourceId": "atlas-pr-054",
    "source": "github",
    "squadId": "atlas",
    "title": "Fix webhook HMAC signature validation",
    "url": "https://github.com/arcline-inc/platform/pull/54",
    "lastUpdated": "2026-05-14T16:33:00Z",
    "raw": {
      "number": 54,
      "state": "open",
      "merged": false,
      "merged_at": null,
      "author": "sarah-chen",
      "body": "Stripe webhooks are rejecting valid events — timing skew issue in HMAC validation. Switching from Date.now() to monotonic clock. Discovered during load test run. Refs ATLS-47.",
      "linked_jira_key": "ATLS-47",
      "base_branch": "main",
      "head_branch": "fix/webhook-hmac-timing",
      "changed_files": 2,
      "additions": 18,
      "deletions": 11,
      "reviewers": ["alex-kumar"],
      "labels": ["bug", "billing", "security"]
    }
  },
  {
    "sourceId": "atlas-pr-055",
    "source": "github",
    "squadId": "atlas",
    "title": "Add billing analytics: MRR breakdown query",
    "url": "https://github.com/arcline-inc/platform/pull/55",
    "lastUpdated": "2026-05-13T09:00:00Z",
    "raw": {
      "number": 55,
      "state": "open",
      "merged": false,
      "merged_at": null,
      "author": "alex-kumar",
      "body": "Analytics spike scope has expanded — PM wants multi-dimensional breakdown. Discussing whether to close and move to separate analytics track.",
      "linked_jira_key": "ATLS-50",
      "base_branch": "main",
      "head_branch": "feature/mrr-breakdown",
      "changed_files": 6,
      "additions": 221,
      "deletions": 0,
      "reviewers": [],
      "labels": ["analytics", "billing"]
    }
  },
  {
    "sourceId": "atlas-pr-057",
    "source": "github",
    "squadId": "atlas",
    "title": "Add feature flags for premium tier entitlements",
    "url": "https://github.com/arcline-inc/platform/pull/57",
    "lastUpdated": "2026-05-16T10:00:00Z",
    "raw": {
      "number": 57,
      "state": "open",
      "merged": false,
      "merged_at": null,
      "author": "jordan-lee",
      "body": "LaunchDarkly feature flags scaffolding. Still blocked on atlas-pr-049 (auth token migration). Lumen v2 is in review but not deployed. Escalating timeline concern to Sarah. Refs ATLS-55.",
      "linked_jira_key": "ATLS-55",
      "base_branch": "main",
      "head_branch": "feature/premium-feature-flags",
      "changed_files": 9,
      "additions": 256,
      "deletions": 43,
      "reviewers": ["sarah-chen"],
      "labels": ["feature", "premium", "feature-flags", "blocked"]
    }
  }
]
