[
  {
    "sourceId": "lumen-pr-031",
    "source": "github",
    "squadId": "lumen",
    "title": "Release auth tokens v2 endpoint",
    "url": "https://github.com/arcline-inc/frontend/pull/31",
    "lastUpdated": "2026-05-19T08:55:00Z",
    "raw": {
      "number": 31,
      "state": "merged",
      "merged": true,
      "merged_at": "2026-05-19T08:55:00Z",
      "author": "priya-nair",
      "body": "Introduces /api/auth/tokens/v2. Breaking changes from v1: token payload now includes `tenantId` and `scopes` fields. v1 endpoint deprecated — sunset June 15. Atlas team has been notified and is migrating. Refs LMNE-22.",
      "linked_jira_key": "LMNE-22",
      "base_branch": "main",
      "head_branch": "feature/auth-tokens-v2",
      "changed_files": 11,
      "additions": 289,
      "deletions": 47,
      "reviewers": ["dev-okonkwo", "kai-zhang"],
      "labels": ["feature", "auth", "api", "breaking-change"]
    }
  },
  {
    "sourceId": "lumen-pr-032",
    "source": "github",
    "squadId": "lumen",
    "title": "Fix theme flickering on dark mode toggle",
    "url": "https://github.com/arcline-inc/frontend/pull/32",
    "lastUpdated": "2026-05-19T14:22:00Z",
    "raw": {
      "number": 32,
      "state": "merged",
      "merged": true,
      "merged_at": "2026-05-19T14:22:00Z",
      "author": "kai-zhang",
      "body": "Resolves flash of wrong theme on toggle by moving theme context initialization to a synchronous effect before first paint. Fixes LMNE-18.",
      "linked_jira_key": "LMNE-18",
      "base_branch": "main",
      "head_branch": "fix/dark-mode-flicker",
      "changed_files": 3,
      "additions": 24,
      "deletions": 16,
      "reviewers": ["priya-nair"],
      "labels": ["bug", "ui", "theme"]
    }
  },
  {
    "sourceId": "lumen-pr-033",
    "source": "github",
    "squadId": "lumen",
    "title": "Add skeleton loaders to main dashboard",
    "url": "https://github.com/arcline-inc/frontend/pull/33",
    "lastUpdated": "2026-05-22T10:40:00Z",
    "raw": {
      "number": 33,
      "state": "open",
      "merged": false,
      "merged_at": null,
      "author": "dev-okonkwo",
      "body": "Replaces blank-screen flash during data fetches with animated skeleton loaders. Design tokens sourced from Figma component library. Refs LMNE-24.",
      "linked_jira_key": "LMNE-24",
      "base_branch": "main",
      "head_branch": "feature/skeleton-loaders",
      "changed_files": 14,
      "additions": 376,
      "deletions": 52,
      "reviewers": ["kai-zhang"],
      "labels": ["feature", "ui", "performance"]
    }
  },
  {
    "sourceId": "lumen-pr-034",
    "source": "github",
    "squadId": "lumen",
    "title": "Refactor component library to use design tokens",
    "url": "https://github.com/arcline-inc/frontend/pull/34",
    "lastUpdated": "2026-05-20T16:15:00Z",
    "raw": {
      "number": 34,
      "state": "merged",
      "merged": true,
      "merged_at": "2026-05-20T16:15:00Z",
      "author": "kai-zhang",
      "body": "Migrates all hardcoded hex color values and spacing to Figma-synced design tokens. Required for dark mode and brand refresh consistency. Refs LMNE-21.",
      "linked_jira_key": "LMNE-21",
      "base_branch": "main",
      "head_branch": "chore/design-token-migration",
      "changed_files": 38,
      "additions": 512,
      "deletions": 489,
      "reviewers": ["priya-nair", "dev-okonkwo"],
      "labels": ["chore", "ui", "design-system"]
    }
  },
  {
    "sourceId": "lumen-pr-035",
    "source": "github",
    "squadId": "lumen",
    "title": "Fix performance regression in data grid virtualization",
    "url": "https://github.com/arcline-inc/frontend/pull/35",
    "lastUpdated": "2026-05-21T11:48:00Z",
    "raw": {
      "number": 35,
      "state": "merged",
      "merged": true,
      "merged_at": "2026-05-21T11:48:00Z",
      "author": "priya-nair",
      "body": "Data grid was re-rendering entire virtual window on scroll. Row identity stabilized with useMemo. P99 scroll jank dropped from 180ms to 22ms. Fixes LMNE-20.",
      "linked_jira_key": "LMNE-20",
      "base_branch": "main",
      "head_branch": "fix/data-grid-perf",
      "changed_files": 2,
      "additions": 31,
      "deletions": 19,
      "reviewers": ["dev-okonkwo"],
      "labels": ["bug", "performance", "ui"]
    }
  },
  {
    "sourceId": "lumen-pr-036",
    "source": "github",
    "squadId": "lumen",
    "title": "Add e2e tests for auth flow using Playwright",
    "url": "https://github.com/arcline-inc/frontend/pull/36",
    "lastUpdated": "2026-05-23T09:30:00Z",
    "raw": {
      "number": 36,
      "state": "open",
      "merged": false,
      "merged_at": null,
      "author": "dev-okonkwo",
      "body": "Adds Playwright e2e tests for sign-in, token refresh, and sign-out flows. Currently blocked — auth service is returning intermittent 503s in the CI environment. Notified in Slack but no ticket yet. Refs LMNE-25.",
      "linked_jira_key": "LMNE-25",
      "base_branch": "main",
      "head_branch": "test/auth-e2e-playwright",
      "changed_files": 7,
      "additions": 428,
      "deletions": 0,
      "reviewers": [],
      "labels": ["test", "auth", "e2e"]
    }
  },
  {
    "sourceId": "lumen-pr-037",
    "source": "github",
    "squadId": "lumen",
    "title": "Upgrade React to 18.3 and enable concurrent features",
    "url": "https://github.com/arcline-inc/frontend/pull/37",
    "lastUpdated": "2026-05-22T14:05:00Z",
    "raw": {
      "number": 37,
      "state": "merged",
      "merged": true,
      "merged_at": "2026-05-22T14:05:00Z",
      "author": "kai-zhang",
      "body": "Upgrades React from 18.2 to 18.3. Enables createRoot for concurrent mode. All useLegacyRef calls migrated. Refs LMNE-19.",
      "linked_jira_key": "LMNE-19",
      "base_branch": "main",
      "head_branch": "chore/react-18-3-upgrade",
      "changed_files": 6,
      "additions": 43,
      "deletions": 41,
      "reviewers": ["priya-nair"],
      "labels": ["chore", "dependencies"]
    }
  },
  {
    "sourceId": "lumen-pr-038",
    "source": "github",
    "squadId": "lumen",
    "title": "Fix accessibility issues on form inputs (WCAG AA)",
    "url": "https://github.com/arcline-inc/frontend/pull/38",
    "lastUpdated": "2026-05-24T09:15:00Z",
    "raw": {
      "number": 38,
      "state": "merged",
      "merged": true,
      "merged_at": "2026-05-24T09:15:00Z",
      "author": "priya-nair",
      "body": "Adds aria-label, aria-describedby, and visible focus rings to all form inputs. Resolves 9 axe violations from the Q1 accessibility audit. Fixes LMNE-17.",
      "linked_jira_key": "LMNE-17",
      "base_branch": "main",
      "head_branch": "fix/form-accessibility",
      "changed_files": 12,
      "additions": 89,
      "deletions": 34,
      "reviewers": ["dev-okonkwo"],
      "labels": ["bug", "accessibility", "ui"]
    }
  },
  {
    "sourceId": "lumen-pr-039",
    "source": "github",
    "squadId": "lumen",
    "title": "Revert gesture navigation experiment — restoring tab bar",
    "url": "https://github.com/arcline-inc/frontend/pull/39",
    "lastUpdated": "2026-05-23T17:00:00Z",
    "raw": {
      "number": 39,
      "state": "open",
      "merged": false,
      "merged_at": null,
      "author": "dev-okonkwo",
      "body": "Reverting the gesture nav spike from last sprint due to negative feedback in user testing. Refs LMNE-26. Note: Forge's Figma file still shows gesture nav spec — someone should sync with their design lead.",
      "linked_jira_key": "LMNE-26",
      "base_branch": "main",
      "head_branch": "revert/gesture-nav",
      "changed_files": 5,
      "additions": 48,
      "deletions": 93,
      "reviewers": ["kai-zhang"],
      "labels": ["revert", "navigation", "ui"]
    }
  }
]
