[
  {
    "sourceId": "atlas-pr-048",
    "source": "github",
    "squadId": "atlas",
    "title": "Add rate limiting middleware to billing API",
    "url": "https://github.com/arcline-inc/platform/pull/48",
    "lastUpdated": "2026-05-04T11:30:00Z",
    "raw": {
      "number": 48,
      "state": "open",
      "merged": false,
      "merged_at": null,
      "author": "sarah-chen",
      "body": "WIP: Adds per-tenant rate limiting to all /billing/* endpoints. Currently scaffolding the middleware. Refs ATLS-38.",
      "linked_jira_key": "ATLS-38",
      "base_branch": "main",
      "head_branch": "feature/billing-rate-limit",
      "changed_files": 1,
      "additions": 22,
      "deletions": 0,
      "reviewers": [],
      "labels": ["backend", "billing", "security"]
    }
  },
  {
    "sourceId": "atlas-pr-049",
    "source": "github",
    "squadId": "atlas",
    "title": "Migrate auth tokens to Lumen /api/auth/tokens/v2",
    "url": "https://github.com/arcline-inc/platform/pull/49",
    "lastUpdated": "2026-05-04T14:00:00Z",
    "raw": {
      "number": 49,
      "state": "open",
      "merged": false,
      "merged_at": null,
      "author": "sarah-chen",
      "body": "Blocked — waiting on Lumen team to ship /api/auth/tokens/v2. Once that endpoint exists, we can migrate off v1 before the June 15 sunset. This unblocks ATLS-55 (premium tier gating). Tracking in Slack #atlas-lumen-sync.",
      "linked_jira_key": "ATLS-55",
      "base_branch": "main",
      "head_branch": "chore/migrate-lumen-auth-v2",
      "changed_files": 0,
      "additions": 0,
      "deletions": 0,
      "reviewers": [],
      "labels": ["chore", "auth", "cross-team", "blocked"]
    }
  },
  {
    "sourceId": "atlas-pr-050",
    "source": "github",
    "squadId": "atlas",
    "title": "Fix NPE in subscription payment processor",
    "url": "https://github.com/arcline-inc/platform/pull/50",
    "lastUpdated": "2026-05-06T09:00:00Z",
    "raw": {
      "number": 50,
      "state": "open",
      "merged": false,
      "merged_at": null,
      "author": "alex-kumar",
      "body": "Investigating NPE in payment processor. Staging logs show `payment.metadata.customerId` is null on some Stripe webhook events. Adding null check. Refs ATLS-41.",
      "linked_jira_key": "ATLS-41",
      "base_branch": "main",
      "head_branch": "fix/payment-processor-npe",
      "changed_files": 2,
      "additions": 4,
      "deletions": 0,
      "reviewers": [],
      "labels": ["bug", "billing", "hotfix"]
    }
  },
  {
    "sourceId": "atlas-pr-051",
    "source": "github",
    "squadId": "atlas",
    "title": "Complete billing API refactor — ATLS-42",
    "url": "https://github.com/arcline-inc/platform/pull/51",
    "lastUpdated": "2026-05-05T10:00:00Z",
    "raw": {
      "number": 51,
      "state": "open",
      "merged": false,
      "merged_at": null,
      "author": "jordan-lee",
      "body": "Sprint goal: refactor billing API to CQRS pattern per architecture review. Splitting monolithic BillingService into BillingQueryService and BillingCommandService. Early stages — only read path separated so far. Closes ATLS-42.",
      "linked_jira_key": "ATLS-42",
      "base_branch": "main",
      "head_branch": "feature/billing-api-refactor",
      "changed_files": 4,
      "additions": 87,
      "deletions": 12,
      "reviewers": [],
      "labels": ["backend", "billing", "refactor"]
    }
  },
  {
    "sourceId": "atlas-pr-052",
    "source": "github",
    "squadId": "atlas",
    "title": "Remove deprecated /billing/v1 endpoints",
    "url": "https://github.com/arcline-inc/platform/pull/52",
    "lastUpdated": "2026-05-05T13:00:00Z",
    "raw": {
      "number": 52,
      "state": "open",
      "merged": false,
      "merged_at": null,
      "author": "alex-kumar",
      "body": "Deprecation cleanup from Q1 notice. All callers confirmed migrated via Datadog trace analysis. Will merge once ATLS-42 refactor lands (shared code paths). Refs ATLS-29.",
      "linked_jira_key": "ATLS-29",
      "base_branch": "main",
      "head_branch": "chore/remove-billing-v1",
      "changed_files": 8,
      "additions": 0,
      "deletions": 287,
      "reviewers": [],
      "labels": ["chore", "billing", "cleanup"]
    }
  },
  {
    "sourceId": "atlas-pr-055",
    "source": "github",
    "squadId": "atlas",
    "title": "Add billing analytics: MRR breakdown query",
    "url": "https://github.com/arcline-inc/platform/pull/55",
    "lastUpdated": "2026-05-07T11:00:00Z",
    "raw": {
      "number": 55,
      "state": "open",
      "merged": false,
      "merged_at": null,
      "author": "alex-kumar",
      "body": "PM request: analytics spike for MRR breakdown. Exploring query approach before committing to a full implementation. Tracking in ATLS-50.",
      "linked_jira_key": "ATLS-50",
      "base_branch": "main",
      "head_branch": "feature/mrr-breakdown",
      "changed_files": 2,
      "additions": 45,
      "deletions": 0,
      "reviewers": [],
      "labels": ["analytics", "billing"]
    }
  },
  {
    "sourceId": "atlas-pr-057",
    "source": "github",
    "squadId": "atlas",
    "title": "Add feature flags for premium tier entitlements",
    "url": "https://github.com/arcline-inc/platform/pull/57",
    "lastUpdated": "2026-05-08T15:00:00Z",
    "raw": {
      "number": 57,
      "state": "open",
      "merged": false,
      "merged_at": null,
      "author": "jordan-lee",
      "body": "LaunchDarkly scaffolding for premium tier feature flags. Hard blocked on atlas-pr-049 (auth token migration) — cannot gate on premium entitlement without the new token scopes from Lumen v2. Refs ATLS-55.",
      "linked_jira_key": "ATLS-55",
      "base_branch": "main",
      "head_branch": "feature/premium-feature-flags",
      "changed_files": 3,
      "additions": 58,
      "deletions": 0,
      "reviewers": [],
      "labels": ["feature", "premium", "feature-flags", "blocked"]
    }
  }
]
