[
  {
    "sourceId": "forge-pr-019",
    "source": "github",
    "squadId": "forge",
    "title": "Implement iOS home screen widget (small variant)",
    "url": "https://github.com/arcline-inc/mobile/pull/19",
    "lastUpdated": "2026-05-19T12:30:00Z",
    "raw": {
      "number": 19,
      "state": "merged",
      "merged": true,
      "merged_at": "2026-05-19T12:30:00Z",
      "author": "mei-tanaka",
      "body": "Adds WidgetKit small variant showing today's task count and next due item. Reads from shared App Group container. Refs FORGE-31.",
      "linked_jira_key": "FORGE-31",
      "base_branch": "main",
      "head_branch": "feature/ios-widget-small",
      "changed_files": 7,
      "additions": 214,
      "deletions": 8,
      "reviewers": ["carlos-mendez"],
      "labels": ["feature", "ios", "widget"]
    }
  },
  {
    "sourceId": "forge-pr-020",
    "source": "github",
    "squadId": "forge",
    "title": "Add haptic feedback to card swipe gestures",
    "url": "https://github.com/arcline-inc/mobile/pull/20",
    "lastUpdated": "2026-05-20T11:10:00Z",
    "raw": {
      "number": 20,
      "state": "merged",
      "merged": true,
      "merged_at": "2026-05-20T11:10:00Z",
      "author": "carlos-mendez",
      "body": "UIImpactFeedbackGenerator on card dismiss/archive swipe. Light impact on initiation, medium on completion. Refs FORGE-33.",
      "linked_jira_key": "FORGE-33",
      "base_branch": "main",
      "head_branch": "feature/haptic-swipe",
      "changed_files": 3,
      "additions": 44,
      "deletions": 5,
      "reviewers": ["mei-tanaka"],
      "labels": ["feature", "ios", "ux"]
    }
  },
  {
    "sourceId": "forge-pr-021",
    "source": "github",
    "squadId": "forge",
    "title": "Fix memory leak in camera permission module",
    "url": "https://github.com/arcline-inc/mobile/pull/21",
    "lastUpdated": "2026-05-21T08:00:00Z",
    "raw": {
      "number": 21,
      "state": "merged",
      "merged": true,
      "merged_at": "2026-05-21T08:00:00Z",
      "author": "mei-tanaka",
      "body": "AVCaptureSession delegate was not being released on dealloc. Weak reference pattern applied. Instruments showed 12MB/session leak; now 0. Fixes FORGE-29.",
      "linked_jira_key": "FORGE-29",
      "base_branch": "main",
      "head_branch": "fix/camera-memory-leak",
      "changed_files": 2,
      "additions": 8,
      "deletions": 4,
      "reviewers": ["carlos-mendez"],
      "labels": ["bug", "ios", "memory"]
    }
  },
  {
    "sourceId": "forge-pr-022",
    "source": "github",
    "squadId": "forge",
    "title": "Implement tab bar navigation structure",
    "url": "https://github.com/arcline-inc/mobile/pull/22",
    "lastUpdated": "2026-05-21T15:45:00Z",
    "raw": {
      "number": 22,
      "state": "merged",
      "merged": true,
      "merged_at": "2026-05-21T15:45:00Z",
      "author": "carlos-mendez",
      "body": "Introduces UITabBarController as the root container per the navigation architecture agreed in sprint planning. Four tabs: Home, Tasks, Notifications, Profile. Refs FORGE-30.",
      "linked_jira_key": "FORGE-30",
      "base_branch": "main",
      "head_branch": "feature/tab-bar-navigation",
      "changed_files": 9,
      "additions": 318,
      "deletions": 112,
      "reviewers": ["mei-tanaka"],
      "labels": ["feature", "ios", "navigation"]
    }
  },
  {
    "sourceId": "forge-pr-023",
    "source": "github",
    "squadId": "forge",
    "title": "Update Figma design token sync script",
    "url": "https://github.com/arcline-inc/mobile/pull/23",
    "lastUpdated": "2026-05-22T09:55:00Z",
    "raw": {
      "number": 23,
      "state": "open",
      "merged": false,
      "merged_at": null,
      "author": "mei-tanaka",
      "body": "Updates the Figma → iOS token export script to pull from the new Forge v2 component library. Note: Figma file has a recent comment from design lead that may affect navigation architecture — review before merging nav-related tickets.",
      "linked_jira_key": "FORGE-35",
      "base_branch": "main",
      "head_branch": "chore/figma-token-sync-v2",
      "changed_files": 2,
      "additions": 15,
      "deletions": 8,
      "reviewers": [],
      "labels": ["chore", "design-system", "ios"]
    }
  },
  {
    "sourceId": "forge-pr-024",
    "source": "github",
    "squadId": "forge",
    "title": "Add offline mode: local SQLite task cache",
    "url": "https://github.com/arcline-inc/mobile/pull/24",
    "lastUpdated": "2026-05-23T14:20:00Z",
    "raw": {
      "number": 24,
      "state": "open",
      "merged": false,
      "merged_at": null,
      "author": "carlos-mendez",
      "body": "Introduces SQLite-backed task cache using GRDB. Syncs on app foreground; reads from cache when network unavailable. Refs FORGE-32.",
      "linked_jira_key": "FORGE-32",
      "base_branch": "main",
      "head_branch": "feature/offline-mode",
      "changed_files": 16,
      "additions": 541,
      "deletions": 23,
      "reviewers": ["mei-tanaka"],
      "labels": ["feature", "ios", "offline", "storage"]
    }
  },
  {
    "sourceId": "forge-pr-025",
    "source": "github",
    "squadId": "forge",
    "title": "Fix crash on iOS 16 during device rotation in task view",
    "url": "https://github.com/arcline-inc/mobile/pull/25",
    "lastUpdated": "2026-05-21T07:30:00Z",
    "raw": {
      "number": 25,
      "state": "merged",
      "merged": true,
      "merged_at": "2026-05-21T07:30:00Z",
      "author": "mei-tanaka",
      "body": "UICollectionViewLayout invalidation on rotation was calling reloadData before layout committed on iOS 16. Deferred with layoutIfNeeded(). Fixes FORGE-28. Note: this was a 3-day-old regression from the grid layout refactor.",
      "linked_jira_key": "FORGE-28",
      "base_branch": "main",
      "head_branch": "fix/ios16-rotation-crash",
      "changed_files": 1,
      "additions": 6,
      "deletions": 2,
      "reviewers": ["carlos-mendez"],
      "labels": ["bug", "ios", "crash", "ios16"]
    }
  },
  {
    "sourceId": "forge-pr-026",
    "source": "github",
    "squadId": "forge",
    "title": "Add deep link routing for push notification tap targets",
    "url": "https://github.com/arcline-inc/mobile/pull/26",
    "lastUpdated": "2026-05-24T11:30:00Z",
    "raw": {
      "number": 26,
      "state": "open",
      "merged": false,
      "merged_at": null,
      "author": "carlos-mendez",
      "body": "Implements arcline:// deep link scheme. Currently routes task:// and notification:// paths to the correct view controller. Depends on navigation structure being finalized — holding for FORGE-30 review. Refs FORGE-36.",
      "linked_jira_key": "FORGE-36",
      "base_branch": "main",
      "head_branch": "feature/deep-link-routing",
      "changed_files": 5,
      "additions": 148,
      "deletions": 12,
      "reviewers": [],
      "labels": ["feature", "ios", "navigation", "push-notifications"]
    }
  }
]
