[
  {
    "sourceId": "forge-pr-019",
    "source": "github",
    "squadId": "forge",
    "title": "Implement iOS home screen widget (small variant)",
    "url": "https://github.com/arcline-inc/mobile/pull/19",
    "lastUpdated": "2026-05-14T10:00:00Z",
    "raw": {
      "number": 19,
      "state": "open",
      "merged": false,
      "merged_at": null,
      "author": "mei-tanaka",
      "body": "Widget implementation complete. Reads from shared App Group container, shows today's task count and next due item. In review. Refs FORGE-31.",
      "linked_jira_key": "FORGE-31",
      "base_branch": "main",
      "head_branch": "feature/ios-widget-small",
      "changed_files": 7,
      "additions": 214,
      "deletions": 8,
      "reviewers": ["carlos-mendez"],
      "labels": ["feature", "ios", "widget"]
    }
  },
  {
    "sourceId": "forge-pr-020",
    "source": "github",
    "squadId": "forge",
    "title": "Add haptic feedback to card swipe gestures",
    "url": "https://github.com/arcline-inc/mobile/pull/20",
    "lastUpdated": "2026-05-12T11:10:00Z",
    "raw": {
      "number": 20,
      "state": "merged",
      "merged": true,
      "merged_at": "2026-05-12T11:10:00Z",
      "author": "carlos-mendez",
      "body": "UIImpactFeedbackGenerator on card dismiss/archive swipe. Light impact on initiation, medium on completion. Refs FORGE-33.",
      "linked_jira_key": "FORGE-33",
      "base_branch": "main",
      "head_branch": "feature/haptic-swipe",
      "changed_files": 3,
      "additions": 44,
      "deletions": 5,
      "reviewers": ["mei-tanaka"],
      "labels": ["feature", "ios", "ux"]
    }
  },
  {
    "sourceId": "forge-pr-021",
    "source": "github",
    "squadId": "forge",
    "title": "Fix memory leak in camera permission module",
    "url": "https://github.com/arcline-inc/mobile/pull/21",
    "lastUpdated": "2026-05-12T09:00:00Z",
    "raw": {
      "number": 21,
      "state": "merged",
      "merged": true,
      "merged_at": "2026-05-12T09:00:00Z",
      "author": "mei-tanaka",
      "body": "Weak reference pattern applied to AVCaptureSession delegate. Instruments: 12MB/session → 0. Fixes FORGE-29.",
      "linked_jira_key": "FORGE-29",
      "base_branch": "main",
      "head_branch": "fix/camera-memory-leak",
      "changed_files": 2,
      "additions": 8,
      "deletions": 4,
      "reviewers": ["carlos-mendez"],
      "labels": ["bug", "ios", "memory"]
    }
  },
  {
    "sourceId": "forge-pr-022",
    "source": "github",
    "squadId": "forge",
    "title": "Implement tab bar navigation structure",
    "url": "https://github.com/arcline-inc/mobile/pull/22",
    "lastUpdated": "2026-05-15T13:00:00Z",
    "raw": {
      "number": 22,
      "state": "open",
      "merged": false,
      "merged_at": null,
      "author": "carlos-mendez",
      "body": "Four-tab UITabBarController implementation complete. In final review. Refs FORGE-30.",
      "linked_jira_key": "FORGE-30",
      "base_branch": "main",
      "head_branch": "feature/tab-bar-navigation",
      "changed_files": 9,
      "additions": 318,
      "deletions": 112,
      "reviewers": ["mei-tanaka"],
      "labels": ["feature", "ios", "navigation"]
    }
  },
  {
    "sourceId": "forge-pr-023",
    "source": "github",
    "squadId": "forge",
    "title": "Update Figma design token sync script",
    "url": "https://github.com/arcline-inc/mobile/pull/23",
    "lastUpdated": "2026-05-15T09:55:00Z",
    "raw": {
      "number": 23,
      "state": "open",
      "merged": false,
      "merged_at": null,
      "author": "mei-tanaka",
      "body": "Updates Figma → iOS token export to pull from Forge v2 component library. Note: there is a pending Figma comment from the design lead that may affect navigation architecture. Reviewing before merging. Refs FORGE-35.",
      "linked_jira_key": "FORGE-35",
      "base_branch": "main",
      "head_branch": "chore/figma-token-sync-v2",
      "changed_files": 2,
      "additions": 15,
      "deletions": 8,
      "reviewers": [],
      "labels": ["chore", "design-system", "ios"]
    }
  },
  {
    "sourceId": "forge-pr-024",
    "source": "github",
    "squadId": "forge",
    "title": "Add offline mode: local SQLite task cache",
    "url": "https://github.com/arcline-inc/mobile/pull/24",
    "lastUpdated": "2026-05-16T14:00:00Z",
    "raw": {
      "number": 24,
      "state": "open",
      "merged": false,
      "merged_at": null,
      "author": "carlos-mendez",
      "body": "GRDB-backed SQLite cache implementation 70% complete. Sync strategy finalized: foreground sync on app resume. In progress. Refs FORGE-32.",
      "linked_jira_key": "FORGE-32",
      "base_branch": "main",
      "head_branch": "feature/offline-mode",
      "changed_files": 10,
      "additions": 380,
      "deletions": 12,
      "reviewers": ["mei-tanaka"],
      "labels": ["feature", "ios", "offline", "storage"]
    }
  },
  {
    "sourceId": "forge-pr-025",
    "source": "github",
    "squadId": "forge",
    "title": "Fix crash on iOS 16 during device rotation in task view",
    "url": "https://github.com/arcline-inc/mobile/pull/25",
    "lastUpdated": "2026-05-12T08:30:00Z",
    "raw": {
      "number": 25,
      "state": "merged",
      "merged": true,
      "merged_at": "2026-05-12T08:30:00Z",
      "author": "mei-tanaka",
      "body": "Deferred reloadData with layoutIfNeeded(). iOS 16 rotation crash resolved. Fixes FORGE-28.",
      "linked_jira_key": "FORGE-28",
      "base_branch": "main",
      "head_branch": "fix/ios16-rotation-crash",
      "changed_files": 1,
      "additions": 6,
      "deletions": 2,
      "reviewers": ["carlos-mendez"],
      "labels": ["bug", "ios", "crash", "ios16"]
    }
  },
  {
    "sourceId": "forge-pr-026",
    "source": "github",
    "squadId": "forge",
    "title": "Add deep link routing for push notification tap targets",
    "url": "https://github.com/arcline-inc/mobile/pull/26",
    "lastUpdated": "2026-05-16T11:00:00Z",
    "raw": {
      "number": 26,
      "state": "open",
      "merged": false,
      "merged_at": null,
      "author": "carlos-mendez",
      "body": "arcline:// routing for task:// and notification:// paths. Still waiting on forge-pr-022 (tab bar) final merge for navigation structure. Refs FORGE-36.",
      "linked_jira_key": "FORGE-36",
      "base_branch": "main",
      "head_branch": "feature/deep-link-routing",
      "changed_files": 5,
      "additions": 148,
      "deletions": 12,
      "reviewers": [],
      "labels": ["feature", "ios", "navigation", "push-notifications"]
    }
  }
]
