[
  {
    "sourceId": "lumen-pr-031",
    "source": "github",
    "squadId": "lumen",
    "title": "Release auth tokens v2 endpoint",
    "url": "https://github.com/arcline-inc/frontend/pull/31",
    "lastUpdated": "2026-05-14T15:00:00Z",
    "raw": {
      "number": 31,
      "state": "open",
      "merged": false,
      "merged_at": null,
      "author": "priya-nair",
      "body": "Auth v2 implementation complete. `/api/auth/tokens/v2` now includes `tenantId` and `scopes` fields. v1 deprecated — sunset June 15. In code review. Atlas team confirmed they're ready to migrate once this ships. Refs LMNE-22.",
      "linked_jira_key": "LMNE-22",
      "base_branch": "main",
      "head_branch": "feature/auth-tokens-v2",
      "changed_files": 11,
      "additions": 289,
      "deletions": 47,
      "reviewers": ["dev-okonkwo", "kai-zhang"],
      "labels": ["feature", "auth", "api", "breaking-change"]
    }
  },
  {
    "sourceId": "lumen-pr-032",
    "source": "github",
    "squadId": "lumen",
    "title": "Fix theme flickering on dark mode toggle",
    "url": "https://github.com/arcline-inc/frontend/pull/32",
    "lastUpdated": "2026-05-12T11:22:00Z",
    "raw": {
      "number": 32,
      "state": "merged",
      "merged": true,
      "merged_at": "2026-05-12T11:22:00Z",
      "author": "kai-zhang",
      "body": "Resolves flash of wrong theme on toggle by moving theme context initialization to a synchronous effect before first paint. Fixes LMNE-18.",
      "linked_jira_key": "LMNE-18",
      "base_branch": "main",
      "head_branch": "fix/dark-mode-flicker",
      "changed_files": 3,
      "additions": 24,
      "deletions": 16,
      "reviewers": ["priya-nair"],
      "labels": ["bug", "ui", "theme"]
    }
  },
  {
    "sourceId": "lumen-pr-034",
    "source": "github",
    "squadId": "lumen",
    "title": "Refactor component library to use design tokens",
    "url": "https://github.com/arcline-inc/frontend/pull/34",
    "lastUpdated": "2026-05-15T14:00:00Z",
    "raw": {
      "number": 34,
      "state": "open",
      "merged": false,
      "merged_at": null,
      "author": "kai-zhang",
      "body": "Migration 90% complete. Final review pass ongoing — large changeset across 38 files. Refs LMNE-21.",
      "linked_jira_key": "LMNE-21",
      "base_branch": "main",
      "head_branch": "chore/design-token-migration",
      "changed_files": 38,
      "additions": 512,
      "deletions": 489,
      "reviewers": ["priya-nair", "dev-okonkwo"],
      "labels": ["chore", "ui", "design-system"]
    }
  },
  {
    "sourceId": "lumen-pr-035",
    "source": "github",
    "squadId": "lumen",
    "title": "Fix performance regression in data grid virtualization",
    "url": "https://github.com/arcline-inc/frontend/pull/35",
    "lastUpdated": "2026-05-13T11:48:00Z",
    "raw": {
      "number": 35,
      "state": "merged",
      "merged": true,
      "merged_at": "2026-05-13T11:48:00Z",
      "author": "priya-nair",
      "body": "Row identity stabilized with useMemo. P99 scroll jank dropped from 180ms to 22ms. Fixes LMNE-20.",
      "linked_jira_key": "LMNE-20",
      "base_branch": "main",
      "head_branch": "fix/data-grid-perf",
      "changed_files": 2,
      "additions": 31,
      "deletions": 19,
      "reviewers": ["dev-okonkwo"],
      "labels": ["bug", "performance", "ui"]
    }
  },
  {
    "sourceId": "lumen-pr-037",
    "source": "github",
    "squadId": "lumen",
    "title": "Upgrade React to 18.3 and enable concurrent features",
    "url": "https://github.com/arcline-inc/frontend/pull/37",
    "lastUpdated": "2026-05-13T14:05:00Z",
    "raw": {
      "number": 37,
      "state": "merged",
      "merged": true,
      "merged_at": "2026-05-13T14:05:00Z",
      "author": "kai-zhang",
      "body": "All 8 useLegacyRef sites migrated to createRoot. React 18.3 concurrent mode enabled. Refs LMNE-19.",
      "linked_jira_key": "LMNE-19",
      "base_branch": "main",
      "head_branch": "chore/react-18-3-upgrade",
      "changed_files": 6,
      "additions": 43,
      "deletions": 41,
      "reviewers": ["priya-nair"],
      "labels": ["chore", "dependencies"]
    }
  },
  {
    "sourceId": "lumen-pr-038",
    "source": "github",
    "squadId": "lumen",
    "title": "Fix accessibility issues on form inputs (WCAG AA)",
    "url": "https://github.com/arcline-inc/frontend/pull/38",
    "lastUpdated": "2026-05-14T12:00:00Z",
    "raw": {
      "number": 38,
      "state": "open",
      "merged": false,
      "merged_at": null,
      "author": "priya-nair",
      "body": "9 aria violations addressed. In review — also adding visible focus rings per Figma design spec. Fixes LMNE-17.",
      "linked_jira_key": "LMNE-17",
      "base_branch": "main",
      "head_branch": "fix/form-accessibility",
      "changed_files": 12,
      "additions": 89,
      "deletions": 34,
      "reviewers": ["dev-okonkwo"],
      "labels": ["bug", "accessibility", "ui"]
    }
  },
  {
    "sourceId": "lumen-pr-033",
    "source": "github",
    "squadId": "lumen",
    "title": "Add skeleton loaders to main dashboard",
    "url": "https://github.com/arcline-inc/frontend/pull/33",
    "lastUpdated": "2026-05-15T10:40:00Z",
    "raw": {
      "number": 33,
      "state": "open",
      "merged": false,
      "merged_at": null,
      "author": "dev-okonkwo",
      "body": "Design tokens now available from lumen-pr-034 merge incoming. Implementing skeleton loader components. Refs LMNE-24.",
      "linked_jira_key": "LMNE-24",
      "base_branch": "main",
      "head_branch": "feature/skeleton-loaders",
      "changed_files": 9,
      "additions": 215,
      "deletions": 31,
      "reviewers": ["kai-zhang"],
      "labels": ["feature", "ui", "performance"]
    }
  }
]
