[
  {
    "sourceId": "lumen-pr-031",
    "source": "github",
    "squadId": "lumen",
    "title": "Release auth tokens v2 endpoint",
    "url": "https://github.com/arcline-inc/frontend/pull/31",
    "lastUpdated": "2026-05-05T11:00:00Z",
    "raw": {
      "number": 31,
      "state": "open",
      "merged": false,
      "merged_at": null,
      "author": "priya-nair",
      "body": "Sprint goal: introduce /api/auth/tokens/v2 with `tenantId` and `scopes` fields. Token payload design is still being finalized — waiting on PM sign-off for the scopes schema. Atlas team is blocked on this for their premium tier gating. Refs LMNE-22.",
      "linked_jira_key": "LMNE-22",
      "base_branch": "main",
      "head_branch": "feature/auth-tokens-v2",
      "changed_files": 3,
      "additions": 74,
      "deletions": 5,
      "reviewers": [],
      "labels": ["feature", "auth", "api", "breaking-change"]
    }
  },
  {
    "sourceId": "lumen-pr-032",
    "source": "github",
    "squadId": "lumen",
    "title": "Fix theme flickering on dark mode toggle",
    "url": "https://github.com/arcline-inc/frontend/pull/32",
    "lastUpdated": "2026-05-06T09:30:00Z",
    "raw": {
      "number": 32,
      "state": "open",
      "merged": false,
      "merged_at": null,
      "author": "kai-zhang",
      "body": "Theme flash on toggle — context initialization is async, causing a frame of wrong theme on first paint. Working on a synchronous initialization fix. Fixes LMNE-18.",
      "linked_jira_key": "LMNE-18",
      "base_branch": "main",
      "head_branch": "fix/dark-mode-flicker",
      "changed_files": 2,
      "additions": 11,
      "deletions": 7,
      "reviewers": [],
      "labels": ["bug", "ui", "theme"]
    }
  },
  {
    "sourceId": "lumen-pr-034",
    "source": "github",
    "squadId": "lumen",
    "title": "Refactor component library to use design tokens",
    "url": "https://github.com/arcline-inc/frontend/pull/34",
    "lastUpdated": "2026-05-07T14:00:00Z",
    "raw": {
      "number": 34,
      "state": "open",
      "merged": false,
      "merged_at": null,
      "author": "kai-zhang",
      "body": "Large refactor migrating hardcoded hex values and spacing to Figma-synced design tokens. Required for dark mode and brand refresh. ~60% complete. Refs LMNE-21.",
      "linked_jira_key": "LMNE-21",
      "base_branch": "main",
      "head_branch": "chore/design-token-migration",
      "changed_files": 22,
      "additions": 287,
      "deletions": 294,
      "reviewers": [],
      "labels": ["chore", "ui", "design-system"]
    }
  },
  {
    "sourceId": "lumen-pr-035",
    "source": "github",
    "squadId": "lumen",
    "title": "Fix performance regression in data grid virtualization",
    "url": "https://github.com/arcline-inc/frontend/pull/35",
    "lastUpdated": "2026-05-06T16:00:00Z",
    "raw": {
      "number": 35,
      "state": "open",
      "merged": false,
      "merged_at": null,
      "author": "priya-nair",
      "body": "Data grid re-rendering entire virtual window on scroll. Root cause: unstable row identity — re-creating row objects on each render. Working on useMemo fix. P99 scroll jank is 180ms currently. Fixes LMNE-20.",
      "linked_jira_key": "LMNE-20",
      "base_branch": "main",
      "head_branch": "fix/data-grid-perf",
      "changed_files": 2,
      "additions": 14,
      "deletions": 8,
      "reviewers": [],
      "labels": ["bug", "performance", "ui"]
    }
  },
  {
    "sourceId": "lumen-pr-037",
    "source": "github",
    "squadId": "lumen",
    "title": "Upgrade React to 18.3 and enable concurrent features",
    "url": "https://github.com/arcline-inc/frontend/pull/37",
    "lastUpdated": "2026-05-08T10:00:00Z",
    "raw": {
      "number": 37,
      "state": "open",
      "merged": false,
      "merged_at": null,
      "author": "kai-zhang",
      "body": "Upgrading React 18.2 → 18.3. Migrating from legacy ReactDOM.render to createRoot. Identified 8 useLegacyRef call sites to migrate. Refs LMNE-19.",
      "linked_jira_key": "LMNE-19",
      "base_branch": "main",
      "head_branch": "chore/react-18-3-upgrade",
      "changed_files": 4,
      "additions": 21,
      "deletions": 20,
      "reviewers": [],
      "labels": ["chore", "dependencies"]
    }
  },
  {
    "sourceId": "lumen-pr-038",
    "source": "github",
    "squadId": "lumen",
    "title": "Fix accessibility issues on form inputs (WCAG AA)",
    "url": "https://github.com/arcline-inc/frontend/pull/38",
    "lastUpdated": "2026-05-08T13:00:00Z",
    "raw": {
      "number": 38,
      "state": "open",
      "merged": false,
      "merged_at": null,
      "author": "priya-nair",
      "body": "Q1 accessibility audit flagged 9 axe violations on form inputs. Adding aria-label, aria-describedby, and visible focus rings. Fixes LMNE-17.",
      "linked_jira_key": "LMNE-17",
      "base_branch": "main",
      "head_branch": "fix/form-accessibility",
      "changed_files": 8,
      "additions": 52,
      "deletions": 18,
      "reviewers": [],
      "labels": ["bug", "accessibility", "ui"]
    }
  },
  {
    "sourceId": "lumen-pr-033",
    "source": "github",
    "squadId": "lumen",
    "title": "Add skeleton loaders to main dashboard",
    "url": "https://github.com/arcline-inc/frontend/pull/33",
    "lastUpdated": "2026-05-07T09:00:00Z",
    "raw": {
      "number": 33,
      "state": "open",
      "merged": false,
      "merged_at": null,
      "author": "dev-okonkwo",
      "body": "Design review in progress — skeleton loader design tokens not yet finalized in Figma. Will start implementation once component library token migration (lumen-pr-034) lands. Refs LMNE-24.",
      "linked_jira_key": "LMNE-24",
      "base_branch": "main",
      "head_branch": "feature/skeleton-loaders",
      "changed_files": 0,
      "additions": 0,
      "deletions": 0,
      "reviewers": [],
      "labels": ["feature", "ui", "performance"]
    }
  }
]
